[
  {
    "title": "betjee: virtual prediction market",
    "description": "built a virtual prediction market for jee shifts, loved on <a href=\"https://www.reddit.com/r/JEENEETards/comments/1r04qpp/so_i_made_it/\" target=\"_blank\">r/jeeneetards</a>. reached 1.2m requests, 2.3k users — mostly from reddit. documented some dumb decisions that blew past the free tier.",
    "link": "/blogs/betjee",
    "highlight": true,
    "date": "Feb 2026",
    "tags": ["nextjs-ts", "postgresql", "serverless system design"]
  },
  {
    "title": "no-cursor",
    "description": "CLI-first code editor with llama.cpp integration for fully local operation.",
    "link": "https://github.com/ahhyoushh/no-cursor",
    "highlight": true,
    "date": "Jan 2026",
    "tags": ["llama.cpp(local ai)", "tui", "git & hashing algos"]
  },
  {
    "title": "filesense",
    "description": "Local file organizer that groups documents using semantic similarity and user feedback.",
    "link": "/FileSense/wiki",
    "highlight": true,
    "date": "Dec 2025",
    "tags": ["sentence-embeddings","FAISS(vector dbs)","epsilon-greedy rl"]
  },
  {
    "title": "sakurafetch",
    "description": "Falling cherry blossom petals + neofetch-style system info in your terminal. Curses-based TUI with multiple themes, wind simulation, and falling petal accumulation.",
    "link": "https://github.com/ahhyoushh/sakurafetch",
    "highlight": true,
    "date": "Jun 2026",
    "tags": ["tui", "python-curses"]
  },
  {
    "title": "air quality index prediction",
    "description": "Predicts next-day AQI values using historical air quality data and machine learning.",
    "link": "https://github.com/ahhyoushh/AQI-Predictor",
    "date": "Oct 2025",
    "tags": ["ml", "random forest regressor"]
  },
  {
    "title": "e-waste recycling platform",
    "description": "Web platform that identifies electronic waste categories and suggests nearby recycling centers.",
    "link": "https://github.com/ahhyoushh/Senku",
    "date": "Sep 2025",
    "tags": ["flask", "api"]
  },
  {
    "title": "face detection doorcam",
    "description": "Real-time face detection system using OpenCV for basic monitoring and alerts.",
    "link": "https://github.com/ahhyoushh/opencv-facedetection-python",
    "date": "Jun 2025",
    "tags": ["opencv"]
  },
  {
    "title": "cli chat application",
    "description": "Command-line chat program implementing basic client–server communication.",
    "link": "https://github.com/ahhyoushh/cli-chat",
    "date": "Mar 2025",
    "tags": ["tui", "api"]
  },
  {
    "title": "discord moderator bot",
    "description": "Discord bot that detects similar phrases using text vectorization for basic moderation.",
    "link": "https://github.com/ahhyoushh/Chad-bot",
    "date": "Jan 2025",
    "tags": ["text-similarity", "discord.py"]
  },
  {
    "title": "movies crud api",
    "description": "REST API for managing movie records built using Go.",
    "link": "https://github.com/ahhyoushh/movies-crud-api-go",
    "date": "Nov 2024",
    "tags": ["go", "rest-api"]
  },
  {
    "title": "trash collector cli",
    "description": "Simple CLI tool to store and track ideas or tasks from the terminal.",
    "link": "https://github.com/ahhyoushh/trash-collector-cli",
    "date": "Aug 2024",
    "tags": [ "dev-tool", "deprecated"]
  }
]
